<?xml version="1.0" encoding="UTF-8"?> 
<p:Stb xmlns:p="http://univ.fr/stb" xmlns:xsi="http://www.w3.org/2001/XMLSchema-instance" xsi:schemaLocation="http://univ.fr/stb stb1.xsd "> 
	 <p:Titre>S</p:Titre> 
	 <p:Version>S</p:Version> 
	 <p:Date>SS</p:Date> 
	 <p:Description>S</p:Description> 
	 <p:Client> 
		 <p:entite>S</p:entite> 
		 <p:Membre> 
			 <p:nom>S</p:nom> 
			 <p:prenom>S</p:prenom> 
		 </p:Membre> 
		 <p:Adresse> 
			 <p:pays>S</p:pays> 
			 <p:ville>S</p:ville> 
			 <p:rue>S</p:rue> 
			 <p:cp></p:cp> 
		 </p:Adresse> 
	 </p:Client> 
	 <p:Equipe> 
		 <p:gender>false</p:gender> 
		 <p:nom>Leneveu</p:nom> 
		 <p:prenom>Lucie</p:prenom> 
	 </p:Equipe> 
	 <p:Equipe> 
		 <p:gender>true</p:gender> 
		 <p:nom>Simeon</p:nom> 
		 <p:prenom>Guillaume</p:prenom> 
	 </p:Equipe> 
	 <p:Fonctionnalite priorite="2"> 
		 <p:desc>Fonc1</p:desc> 
		 <p:Exigence> 
			 <p:identifiant>20</p:identifiant> 
			 <p:desc>Desc ex1</p:desc> 
			 <p:priorite>6</p:priorite> 
		 </p:Exigence> 
		 <p:Exigence> 
			 <p:identifiant>35</p:identifiant> 
			 <p:desc>Desc ex2</p:desc> 
			 <p:priorite>10</p:priorite> 
		 </p:Exigence> 
	 </p:Fonctionnalite> 
	 <p:Commentaire>S</p:Commentaire> 
</p:Stb>